### ISSUE TITLE
Implement SYN_ACK on receiving a SYN

### ISSUE THREAD

**Issue by jrhee17** [jrhee17/tcp-go#1]
Starting with server side implementation should be easier since we already have the test env. setup.
When SYN is received, SYN_ACK should be returned with all the necessary header values set.

Reference: https://tools.ietf.org/html/rfc793#section-3.1

**Comment by jrhee17** [comment]
IP is received (ignoring options).   TCP header is invalid atm

    1   0.000000    10.1.0.10 → 10.1.0.20    TCP 68 61162 → 80 [SYN, ECN, CWR] Seq=0 Win=65535 Len=0 MSS=1460 WS=64 TSval=717258483 TSecr=0 SACK_PERM=1
    2   0.000268    10.1.0.20 → 10.1.0.10    TCP 44 0 → 0 [SYN, ACK] Seq=0 Ack=1 Win=0, bogus TCP header length (0, must be at least 20)
    3   1.005015    10.1.0.10 → 10.1.0.20    TCP 68 [TCP Retransmission] 61162 → 80 [SYN] Seq=0 Win=65535 Len=0 MSS=1460 WS=64 TSval=717259484 TSecr=0 SACK_PERM=1
    4   1.005308    10.1.0.20 → 10.1.0.10    TCP 44 0 → 0 [SYN, ACK] Seq=0 Ack=1 Win=0, bogus TCP header length (0, must be at least 20)
